{
  "$schema": "https://json-schema.org/draft/2020-12/schema",
  "$id": "https://tsumugi-loom.local/schemas/plan-artifact.schema.json",
  "title": "PlanArtifact",
  "type": "object",
  "additionalProperties": false,
  "required": [
    "schemaVersion",
    "workflowId",
    "planStatus",
    "goal",
    "sourceUserRequest",
    "problem",
    "scope",
    "outOfScope",
    "constraints",
    "assumptions",
    "openQuestions",
    "taskBreakdown",
    "acceptanceCriteria",
    "testStrategy",
    "docsImpact",
    "relevantKnowledgeBaseSlices",
    "handoffNotesForCoding"
  ],
  "properties": {
    "$schema": {
      "type": "string"
    },
    "schemaVersion": {
      "type": "string",
      "const": "1.0.0"
    },
    "workflowId": {
      "type": "string",
      "minLength": 1
    },
    "planStatus": {
      "type": "string",
      "enum": ["ready", "needs_clarification"]
    },
    "goal": {
      "type": "string",
      "minLength": 1
    },
    "sourceUserRequest": {
      "type": "string",
      "minLength": 1
    },
    "problem": {
      "type": "string",
      "minLength": 1
    },
    "scope": {
      "type": "array",
      "minItems": 1,
      "items": {
        "type": "string",
        "minLength": 1
      }
    },
    "outOfScope": {
      "type": "array",
      "minItems": 1,
      "items": {
        "type": "string",
        "minLength": 1
      }
    },
    "constraints": {
      "type": "array",
      "minItems": 1,
      "items": {
        "type": "string",
        "minLength": 1
      }
    },
    "assumptions": {
      "type": "array",
      "minItems": 1,
      "items": {
        "type": "string",
        "minLength": 1
      }
    },
    "openQuestions": {
      "type": "array",
      "items": {
        "type": "object",
        "additionalProperties": false,
        "required": ["question", "blocking"],
        "properties": {
          "question": {
            "type": "string",
            "minLength": 1
          },
          "blocking": {
            "type": "boolean"
          }
        }
      }
    },
    "taskBreakdown": {
      "type": "array",
      "minItems": 1,
      "items": {
        "type": "object",
        "additionalProperties": false,
        "required": ["id", "title", "description"],
        "properties": {
          "id": {
            "type": "string",
            "minLength": 1
          },
          "title": {
            "type": "string",
            "minLength": 1
          },
          "description": {
            "type": "string",
            "minLength": 1
          }
        }
      }
    },
    "acceptanceCriteria": {
      "type": "array",
      "minItems": 1,
      "items": {
        "type": "string",
        "minLength": 1
      }
    },
    "testStrategy": {
      "type": "array",
      "minItems": 1,
      "items": {
        "type": "string",
        "minLength": 1
      }
    },
    "docsImpact": {
      "type": "array",
      "minItems": 1,
      "items": {
        "type": "string",
        "minLength": 1
      }
    },
    "relevantKnowledgeBaseSlices": {
      "type": "array",
      "minItems": 1,
      "items": {
        "type": "string",
        "minLength": 1
      }
    },
    "handoffNotesForCoding": {
      "type": "string",
      "minLength": 1
    }
  }
}