{
  "$schema": "../../../docs/process/plan-artifact.schema.json",
  "schemaVersion": "1.0.0",
  "workflowId": "20260424-181535-scaffold-smoke-test",
  "planStatus": "ready",
  "goal": "验证 workflow 自动化",
  "sourceUserRequest": "用户希望保留两份讨论文档不动，但在当前项目里先搭一套能承载 artifact-first 和 knowledge-base-first 思路的本地开发自动化流程。",
  "problem": "当前仓库缺少一套显式、可追溯的开发回合流程，无法把计划、实现、验证、review 和文档整理固化成可重复执行的协议。",
  "scope": [
    "创建 canonical docs 的最小骨架。",
    "创建 workflow artifacts 目录约定。",
    "提供 start、validate 和 reconcile 三条命令。",
    "通过 smoke-test workflow 验证这套流程可运行。"
  ],
  "outOfScope": [
    "UI 节点编排 runtime。",
    "自动改写 canonical docs。",
    "远程 artifact 存储和多 agent 会话隔离。"
  ],
  "constraints": [
    "不修改 TSUMUGI_LOOM_DISCUSSION_SUMMARY.zh-CN.md 和 TSUMUGI_LOOM_KNOWLEDGE_BASE_PROPOSAL.zh-CN.md。",
    "流程必须先以本地仓库协议落地，而不是依赖 UI 节点系统。",
    "canonical docs 只能被显式确认后修改，不能被 reconcile 自动写回。"
  ],
  "assumptions": [
    "当前项目阶段以 Vue/Vite 前端仓库为实验载体。",
    "先接受 Plan、Coding、Test、Review、Docs Reconciler 作为开发阶段映射。",
    "使用 markdown 和 JSON 作为第一版 artifact 载体已经足够。"
  ],
  "openQuestions": [
    {
      "question": "第一版是否还需要进一步把 PlanArtifact 做成更丰富的 JSON schema。",
      "blocking": false
    },
    {
      "question": "未来是否需要把 planning 阶段升级为真正独立的 agent node。",
      "blocking": false
    }
  ],
  "taskBreakdown": [
    {
      "id": "T1",
      "title": "落地知识库骨架",
      "description": "新增 ARCHITECTURE、CONVENTIONS 和 DOMAIN 文档。"
    },
    {
      "id": "T2",
      "title": "落地 workflow 目录",
      "description": "新增 generated run knowledge、decisions 和 workflow artifacts 目录说明。"
    },
    {
      "id": "T3",
      "title": "实现 CLI 脚本",
      "description": "实现 scripts/loom 下的 start、validate 和 reconcile 脚本。"
    },
    {
      "id": "T4",
      "title": "验证链路",
      "description": "跑通 workflow 创建、校验和 reconcile。"
    }
  ],
  "acceptanceCriteria": [
    "能创建带标准 artifacts 的 workflow 目录。",
    "validate 能阻止未填完模板的 workflow 继续前进。",
    "reconcile 能生成 run knowledge 和 reconciliation 报告。",
    "canonical docs 不会被脚本自动改写。"
  ],
  "testStrategy": [
    "运行 pnpm loom:workflow:start 验证 scaffold 创建成功。",
    "在模板未补齐时运行 pnpm loom:workflow:validate，确认它按预期失败。",
    "补齐 artifacts 后再次运行 validate，确认通过。",
    "运行 pnpm loom:workflow:reconcile，确认生成 run knowledge 与 reconciliation 报告。"
  ],
  "docsImpact": [
    "新增 canonical docs 骨架。",
    "新增 workflow automation 说明。",
    "本次 run knowledge 保留在 generated 区域，canonical docs 只记录已确认的稳定事实。"
  ],
  "relevantKnowledgeBaseSlices": [
    "ARCHITECTURE.md",
    "docs/CONVENTIONS.md",
    "docs/DOMAIN.md",
    "TSUMUGI_LOOM_DISCUSSION_SUMMARY.zh-CN.md",
    "TSUMUGI_LOOM_KNOWLEDGE_BASE_PROPOSAL.zh-CN.md"
  ],
  "handoffNotesForCoding": "Coding 阶段应只围绕 workflow 骨架、知识库目录、脚本入口和最小验证链路展开，不需要在本轮引入真正的 runtime 或 UI 节点系统。"
}