{
  "$schema": "../../../docs/process/plan-artifact.schema.json",
  "schemaVersion": "1.0.0",
  "workflowId": "20260424-184331-one-shot-smoke",
  "planStatus": "needs_clarification",
  "goal": "验证 plan json 与 clarification scaffold",
  "sourceUserRequest": "本轮只用于验证 workflow scaffold 是否已经能够同时输出 plan.md、plan.json 和 clarification.md，并确认在仍需澄清时 validate 会阻止进入 Coding。",
  "problem": "需要确认新的 planning artifacts 不只是被创建出来，而且当计划仍处于待澄清状态时，workflow 会被明确 gate 住。",
  "scope": [
    "使用新 scaffold 创建一个 smoke workflow。",
    "将其填成结构完整但仍需澄清的 plan 样例。"
  ],
  "outOfScope": [
    "不进入实际 Coding。",
    "不生成 reconciliation 产物。"
  ],
  "constraints": [
    "需要使用新的 plan.json 和 clarification.md 结构。",
    "需要让失败原因来自 clarification gate，而不是 TODO 或 schema 结构错误。"
  ],
  "assumptions": [
    "当前 smoke workflow 允许只作为门禁验证样例存在。",
    "validate 应把 needs_clarification 视为不能进入 Coding 的阻塞状态。"
  ],
  "openQuestions": [
    {
      "question": "当前是否需要同时实现新的 workflow 子命令来处理 clarification loop。",
      "blocking": true
    }
  ],
  "taskBreakdown": [
    {
      "id": "T1",
      "title": "创建 smoke workflow",
      "description": "使用新的 scaffold 创建 workflow 并确认新的 planning artifacts 已生成。"
    },
    {
      "id": "T2",
      "title": "填充 needs_clarification 示例",
      "description": "为 plan.md、plan.json 和 clarification.md 填入完整且一致的待澄清内容。"
    },
    {
      "id": "T3",
      "title": "验证 clarification gate",
      "description": "运行 validate 并确认失败原因指向 needs_clarification gate。"
    }
  ],
  "acceptanceCriteria": [
    "plan.md 和 plan.json 结构完整且状态一致。",
    "clarification.md 为 open。",
    "validate 失败原因明确指向 needs_clarification gate。"
  ],
  "testStrategy": [
    "运行 pnpm loom:workflow:validate -- 20260424-184331-one-shot-smoke。",
    "检查输出中是否明确说明 workflow 不能进入 Coding。"
  ],
  "docsImpact": [
    "本次主要验证 workflow 机制，不修改 canonical docs。",
    "如有需要，只把结果保留为 smoke-test 参考。"
  ],
  "relevantKnowledgeBaseSlices": [
    "ARCHITECTURE.md",
    "docs/CONVENTIONS.md",
    "docs/process/PLAN_ARTIFACT_SCHEMA.zh-CN.md",
    "docs/process/CLARIFICATION_ARTIFACT.zh-CN.md"
  ],
  "handoffNotesForCoding": "当前 workflow 不应进入 Coding；需要先解决澄清问题，再把 Plan Status 调整为 ready。"
}
