{
  "$schema": "../../../docs/process/plan-artifact.schema.json",
  "schemaVersion": "1.0.0",
  "workflowId": "20260425-095256-vue-flow-mvp-five-node-dag-spike",
  "planStatus": "ready",
  "goal": "Spike a Vue Flow MVP for a five-node DAG workflow.",
  "sourceUserRequest": "用户希望把当前 agent 编排工具的最小可跑通流程快速做出来，并选择直接做一个 Vue Flow 前端 spike，把 Plan、Coding、Test、Review 和增量更新 knowledge base 这些节点画成可试用的五节点 DAG。",
  "problem": "当前仓库没有把五阶段 workflow automation 落成一个可交互、可检查、可验证的可视化执行合同，需要一个最小前端 spike 来验证 Vue Flow 是否适合作为 DAG 画布层。",
  "scope": [
    "实现固定的五节点 DAG 画布和节点详情面板。",
    "补充图模型的逻辑测试和画布主交互路径的 UI 测试。",
    "修正 Playwright webServer 配置并完成构建验证。",
    "收紧 workflow validate 的 artifact 门禁，确保 test-review 与 knowledge-delta 最小结构合同被真正校验。"
  ],
  "outOfScope": [
    "不实现真正的节点执行 runtime 或 DAG 调度引擎。",
    "不支持用户自由拖拽改线或自定义节点结构。"
  ],
  "constraints": [
    "保持当前仓库定义的 Plan、Coding、Test、Review、Docs Reconciler 阶段边界。",
    "保持严格五节点 DAG 的只读 MVP 语义，不暴露误导性的可连线 handles。",
    "以最小改动接入现有 Vue 3 + Vite + TypeScript 壳层。"
  ],
  "assumptions": [
    "底层执行仍由现有 workflow script 和 skills 承担，这次 spike 只验证可视化层。",
    "用户当前优先级是尽快试用前端流程，而不是先扩展 runtime。"
  ],
  "openQuestions": [
    {
      "question": "无阻塞问题，本次已有足够信息进入实现。",
      "blocking": false
    }
  ],
  "taskBreakdown": [
    {
      "id": "T1",
      "title": "定义五节点图模型",
      "description": "新增纯 TypeScript workflow graph 模型，显式声明阶段、状态、输出和连接关系。"
    },
    {
      "id": "T2",
      "title": "接入 Vue Flow 画布",
      "description": "用 Vue Flow 渲染固定 DAG、节点卡片、摘要面板和详情面板。"
    },
    {
      "id": "T3",
      "title": "补齐逻辑测试",
      "description": "用 Vitest 覆盖图模型顺序、摘要、lookup、防御性拷贝和状态标签合同。"
    },
    {
      "id": "T4",
      "title": "修正选中态与只读语义",
      "description": "让详情面板与画布选中同步，并移除只读 DAG 不应显示的 handles。"
    },
    {
      "id": "T5",
      "title": "补齐 UI 测试与构建验证",
      "description": "新增 Playwright 用例，修正 webServer 启动命令，并跑通 UI 测试和 production build。"
    },
    {
      "id": "T6",
      "title": "补齐 workflow validate 回归保护",
      "description": "为 test-review approved gate、canonical sourceNodeIds 和 malformed candidateFacts 增加验证逻辑与回归测试。"
    }
  ],
  "acceptanceCriteria": [
    "页面渲染固定五节点 DAG，并展示明确的 handoff 和节点状态。",
    "默认选中当前运行节点，侧栏与画布点击都能同步切换详情面板。",
    "画布不暴露可编辑连线 handles。",
    "Vitest、Playwright 和 build 全部通过。"
  ],
  "testStrategy": [
    "运行 pnpm test:logic tests/logic/workflow-graph.test.ts。",
    "运行 pnpm test:logic tests/logic/workflow-validation.test.ts。",
    "运行 pnpm test:ui tests/ui/workflow-spike.spec.ts。",
    "运行 pnpm build。",
    "运行 pnpm loom:workflow:validate -- 20260425-095256-vue-flow-mvp-five-node-dag-spike。"
  ],
  "docsImpact": [
    "本次主要补充 workflow artifacts，不直接更新 canonical docs。",
    "后续若确认 Vue Flow 成为正式画布层，再决定是否写回长期文档。"
  ],
  "relevantKnowledgeBaseSlices": [
    "ARCHITECTURE.md",
    "docs/CONVENTIONS.md",
    "docs/DOMAIN.md",
    "TSUMUGI_LOOM_DISCUSSION_SUMMARY.zh-CN.md",
    "TSUMUGI_LOOM_KNOWLEDGE_BASE_PROPOSAL.zh-CN.md"
  ],
  "handoffNotesForCoding": "先锁定五节点 DAG 的纯模型和主交互路径，再接入 Vue Flow 画布。Coding 必须交付选中态同步、只读 DAG 无 handles、Vitest 覆盖图模型合同、Playwright 覆盖默认选中与点击切换，并在环境层修正 Playwright webServer 和浏览器依赖。若 review 发现前端 DAG 与 workflow artifacts 的合同漂移，应在同一回合内补齐 scripts/loom 的 validate 规则与对应回归测试。"
}
